{
  "task_id": "I-0009-060",
  "reviewer": "harness-reviewer",
  "decision": "approved",
  "tool": "codex",
  "review_contract": "repo-reviewer-artifact-v1",
  "executed_protocol_paths": [
    "reviewers/protocols.json",
    ".codex/agents/harness-reviewer.toml",
    ".agents/skills/review-output-contract/SKILL.md",
    ".agents/skills/harness-review-checklist/SKILL.md"
  ],
  "compatible_protocol_paths": [
    ".claude/agents/harness-reviewer.md",
    ".claude/skills/review-output-contract/SKILL.md",
    ".claude/skills/harness-review-checklist/SKILL.md"
  ],
  "reviewed_at": "2026-04-28T18:42:56+0900",
  "findings": [],
  "residual_risks": [
    "The SSE-removal proof now excludes historical ADRs, so future transport migrations should preserve the same distinction between historical artifacts and live repo truth.",
    "Active-task closeout automation only checks metadata and artifact presence; it does not independently exercise live realtime deployment behavior."
  ]
}
