{
  "task_id": "I-0014-360",
  "reviewer": "ui-ux-reviewer",
  "decision": "approved",
  "tool": "codex-manual-review",
  "review_contract": "repo-reviewer-artifact-v1",
  "executed_protocol_paths": [
    ".codex/agents/ui-ux-reviewer.toml",
    ".agents/skills/review-output-contract/SKILL.md",
    ".agents/skills/ui-ux-review-checklist/SKILL.md"
  ],
  "compatible_protocol_paths": [
    ".claude/agents/ui-ux-reviewer.md",
    ".claude/skills/review-output-contract/SKILL.md",
    ".claude/skills/ui-ux-review-checklist/SKILL.md"
  ],
  "reviewed_at": "2026-04-04T23:38:53+09:00",
  "findings": [],
  "residual_risks": [
    "모바일 첫 화면의 card 느낌과 과한 세로 점유는 줄었지만, 이후 분석 섹션이 더 복잡해지면 다시 center-column 감각으로 회귀하지 않도록 지속적인 밀도 관리가 필요하다."
  ]
}
