{
  "task_id": "I-0014-360",
  "reviewer": "po-reviewer",
  "decision": "approved",
  "tool": "codex-manual-review",
  "review_contract": "repo-reviewer-artifact-v1",
  "executed_protocol_paths": [
    ".codex/agents/po-reviewer.toml",
    ".agents/skills/review-output-contract/SKILL.md",
    ".agents/skills/po-review-checklist/SKILL.md"
  ],
  "compatible_protocol_paths": [
    ".claude/agents/po-reviewer.md",
    ".claude/skills/review-output-contract/SKILL.md",
    ".claude/skills/po-review-checklist/SKILL.md"
  ],
  "reviewed_at": "2026-04-04T23:38:53+09:00",
  "findings": [],
  "residual_risks": [
    "이번 task는 workout detail hero의 mobile density 보정에만 집중했으므로, 동일한 edge-aligned 원칙을 다른 detail surfaces에 확장할지는 별도 product 판단이 필요하다."
  ]
}
