{
  "task_id": "I-0019-010",
  "reviewer": "docs-reviewer",
  "decision": "approved",
  "tool": "codex-manual-review",
  "review_contract": "repo-reviewer-artifact-v1",
  "executed_protocol_paths": [
    ".codex/agents/docs-reviewer.toml",
    ".agents/skills/review-output-contract/SKILL.md",
    ".agents/skills/docs-review-checklist/SKILL.md"
  ],
  "compatible_protocol_paths": [
    ".claude/agents/docs-reviewer.md",
    ".claude/skills/review-output-contract/SKILL.md",
    ".claude/skills/docs-review-checklist/SKILL.md"
  ],
  "reviewed_at": "2026-04-22T14:29:29Z",
  "findings": [],
  "residual_risks": [
    "The docs stay accurate only while the externally managed GitHub environment and Secret Manager state recorded in EX-0006 remains current."
  ]
}
