{
  "task_id": "I-0020-010",
  "reviewer": "frontend-reviewer",
  "decision": "approved",
  "tool": "codex-manual-protocol-review",
  "review_contract": "repo-reviewer-artifact-v1",
  "executed_protocol_paths": [
    ".codex/agents/frontend-reviewer.toml",
    ".agents/skills/review-output-contract/SKILL.md",
    ".agents/skills/frontend-review-checklist/SKILL.md"
  ],
  "compatible_protocol_paths": [
    ".claude/agents/frontend-reviewer.md",
    ".claude/skills/review-output-contract/SKILL.md",
    ".claude/skills/frontend-review-checklist/SKILL.md"
  ],
  "reviewed_at": "2026-05-05T08:18:51Z",
  "findings": [],
  "residual_risks": [
    "Storybook removal does not exercise route flows by itself, so real-route manual QA should still spot-check representative feed, profile, crew, and workout surfaces when future UI work lands.",
    "Reviewer subagent spawning was attempted in-session but blocked by an agent thread-limit error, so this artifact was produced with the same protocol as an in-session fallback."
  ]
}
