{
  "task_id": "I-0017-050",
  "reviewer": "po-reviewer",
  "decision": "approved",
  "tool": "codex-manual-review",
  "review_contract": "repo-reviewer-artifact-v1",
  "executed_protocol_paths": [
    ".codex/agents/po-reviewer.toml",
    ".agents/skills/review-output-contract/SKILL.md",
    ".agents/skills/po-review-checklist/SKILL.md"
  ],
  "compatible_protocol_paths": [
    ".claude/agents/po-reviewer.md",
    ".claude/skills/review-output-contract/SKILL.md",
    ".claude/skills/po-review-checklist/SKILL.md"
  ],
  "reviewed_at": "2026-04-04T07:51:54Z",
  "findings": [],
  "residual_risks": [
    "protocol artifact tracking은 복구됐지만, 이후 reviewer taxonomy 변경 시 ignore 규칙도 함께 유지하는 운영 습관이 계속 필요하다."
  ]
}
