{
  "task_id": "I-0016-070",
  "reviewer": "frontend-reviewer",
  "decision": "approved",
  "tool": "codex-manual-protocol-review",
  "review_contract": "repo-reviewer-artifact-v1",
  "executed_protocol_paths": [
    ".codex/agents/frontend-reviewer.toml",
    ".agents/skills/review-output-contract/SKILL.md",
    ".agents/skills/frontend-review-checklist/SKILL.md"
  ],
  "compatible_protocol_paths": [
    ".claude/agents/frontend-reviewer.md",
    ".claude/skills/review-output-contract/SKILL.md",
    ".claude/skills/frontend-review-checklist/SKILL.md"
  ],
  "reviewed_at": "2026-04-04T15:57:37Z",
  "findings": [],
  "residual_risks": [
    "Followers/following now behaves as a protected route instead of a public route with an API failure, but the pages still use local fetch/orchestration rather than a shared profile route model.",
    "Because the route is protected at the router level, any future attempt to reopen it publicly should also revisit the page fetch paths and transition affordances rather than only moving the route entry."
  ]
}
