{
  "task_id": "I-0018-050",
  "reviewer": "backend-reviewer",
  "decision": "approved",
  "tool": "codex-manual-protocol-review",
  "review_contract": "repo-reviewer-artifact-v1",
  "executed_protocol_paths": [
    ".codex/agents/backend-reviewer.toml",
    ".agents/skills/review-output-contract/SKILL.md",
    ".agents/skills/backend-review-checklist/SKILL.md"
  ],
  "compatible_protocol_paths": [
    ".claude/agents/backend-reviewer.md",
    ".claude/skills/review-output-contract/SKILL.md",
    ".claude/skills/backend-review-checklist/SKILL.md"
  ],
  "reviewed_at": "2026-04-22T18:15:21Z",
  "findings": [],
  "residual_risks": [
    "The cleanup migration blocks schema removal on missing sourcePath/detailPath, but it cannot prove object-store blob readability. That remaining operational risk is intentionally handled at read time via degraded responses and warning logs in WorkoutsService.",
    "This review relied on the reported green verification runs rather than re-running them inside the reviewer thread."
  ]
}
