{
  "task_id": "I-0018-050",
  "reviewer": "po-reviewer",
  "decision": "approved",
  "tool": "codex-manual-protocol-review",
  "review_contract": "repo-reviewer-artifact-v1",
  "executed_protocol_paths": [
    ".codex/agents/po-reviewer.toml",
    ".agents/skills/review-output-contract/SKILL.md",
    ".agents/skills/po-review-checklist/SKILL.md"
  ],
  "compatible_protocol_paths": [
    ".claude/agents/po-reviewer.md",
    ".claude/skills/review-output-contract/SKILL.md",
    ".claude/skills/po-review-checklist/SKILL.md"
  ],
  "reviewed_at": "2026-04-22T18:15:21Z",
  "findings": [],
  "residual_risks": [
    "The cleanup keeps the product contract aligned by preserving blob-backed detail, feed preview shape, and degraded empty-state handling. Remaining runtime recovery for unreadable blobs depends on warning signals plus required sourcePath integrity.",
    "This approval relied on the reported green verify runs rather than re-running them inside the reviewer thread."
  ]
}
