{
  "task_id": "I-0009-060",
  "reviewer": "backend-reviewer",
  "decision": "approved",
  "tool": "codex",
  "review_contract": "repo-reviewer-artifact-v1",
  "executed_protocol_paths": [
    "reviewers/protocols.json",
    ".codex/agents/backend-reviewer.toml",
    ".agents/skills/review-output-contract/SKILL.md",
    ".agents/skills/backend-review-checklist/SKILL.md"
  ],
  "compatible_protocol_paths": [
    ".claude/agents/backend-reviewer.md",
    ".claude/skills/review-output-contract/SKILL.md",
    ".claude/skills/backend-review-checklist/SKILL.md"
  ],
  "reviewed_at": "2026-04-28T18:56:26+0900",
  "findings": [],
  "residual_risks": [
    "Realtime fan-out is still process-local, so multi-instance delivery remains a documented runtime limitation outside the scope of this task.",
    "The focused backend regression coverage now protects unread recount failure handling and the raw 2000-character websocket message boundary; broader reconnect and deployed-lane realtime behavior still depends on later end-to-end validation."
  ]
}
