{
  "task_id": "I-0016-110",
  "reviewer": "po-reviewer",
  "decision": "approved",
  "tool": "codex-subagent-review",
  "review_contract": "repo-reviewer-artifact-v1",
  "executed_protocol_paths": [
    "reviewers/protocols.json",
    ".codex/agents/po-reviewer.toml",
    ".agents/skills/review-output-contract/SKILL.md",
    ".agents/skills/po-review-checklist/SKILL.md"
  ],
  "compatible_protocol_paths": [
    ".claude/agents/po-reviewer.md",
    ".claude/skills/review-output-contract/SKILL.md",
    ".claude/skills/po-review-checklist/SKILL.md"
  ],
  "reviewed_at": "2026-04-09T07:50:50Z",
  "findings": [],
  "residual_risks": [
    "PB metadata limitations are handled honestly in the UI and docs, but race/date-rich record presentation still requires a separate schema/API expansion task.",
    "Public-profile crew tabs can still differ in depth when the data source falls back to `recentPosts` previews instead of the full crew posts feed."
  ]
}
