{
  "task_id": "I-0009-060",
  "reviewer": "frontend-reviewer",
  "decision": "approved",
  "tool": "codex",
  "review_contract": "repo-reviewer-artifact-v1",
  "executed_protocol_paths": [
    "reviewers/protocols.json",
    ".codex/agents/frontend-reviewer.toml",
    ".agents/skills/review-output-contract/SKILL.md",
    ".agents/skills/frontend-review-checklist/SKILL.md"
  ],
  "compatible_protocol_paths": [
    ".claude/agents/frontend-reviewer.md",
    ".claude/skills/review-output-contract/SKILL.md",
    ".claude/skills/frontend-review-checklist/SKILL.md"
  ],
  "reviewed_at": "2026-04-28T18:49:47+0900",
  "findings": [],
  "residual_risks": [
    "This pass was read-only and based on source inspection plus the task's recorded verify coverage; it did not rerun a live browser reconnect cycle.",
    "Unread badge ownership is now centralized in the shared realtime provider, so later shell-level badge work should keep using this cache contract instead of reintroducing local polling or per-component transports.",
    "The focused unit coverage exercises provider cache updates and the chat read fallback, but a deployed or browser-level sanity check is still the best place to catch reconnect timing edge cases."
  ]
}
