{
  "task_id": "I-0014-350",
  "reviewer": "frontend-reviewer",
  "decision": "approved",
  "tool": "codex-manual-review",
  "review_contract": "repo-reviewer-artifact-v1",
  "executed_protocol_paths": [
    ".codex/agents/frontend-reviewer.toml",
    ".agents/skills/review-output-contract/SKILL.md",
    ".agents/skills/frontend-review-checklist/SKILL.md"
  ],
  "compatible_protocol_paths": [
    ".claude/agents/frontend-reviewer.md",
    ".claude/skills/review-output-contract/SKILL.md",
    ".claude/skills/frontend-review-checklist/SKILL.md"
  ],
  "reviewed_at": "2026-04-04T21:15:00+09:00",
  "findings": [],
  "residual_risks": [
    "이번 변경은 workout detail 첫 섹션에만 적용됐으므로, 다른 detail 화면이 같은 cardless hero 패턴을 원하면 별도 정렬이 필요하다."
  ]
}
