{
  "task_id": "I-0016-129",
  "reviewer": "po-reviewer",
  "decision": "approved",
  "tool": "codex-subagent-review",
  "review_contract": "repo-reviewer-artifact-v1",
  "executed_protocol_paths": [
    ".codex/agents/po-reviewer.toml",
    ".agents/skills/review-output-contract/SKILL.md",
    ".agents/skills/po-review-checklist/SKILL.md"
  ],
  "compatible_protocol_paths": [
    ".claude/agents/po-reviewer.md",
    ".claude/skills/review-output-contract/SKILL.md",
    ".claude/skills/po-review-checklist/SKILL.md"
  ],
  "reviewed_at": "2026-05-04T09:43:03Z",
  "findings": [],
  "residual_risks": [
    "The remaining release risk is polish-level manual QA for sticky tabs, floating quick actions, and browser-back behavior from deep-linked board post detail on real small-screen devices."
  ]
}
