{
  "task_id": "I-0016-040",
  "reviewer": "harness-reviewer",
  "decision": "approved",
  "tool": "codex-manual-protocol-review",
  "review_contract": "repo-reviewer-artifact-v1",
  "executed_protocol_paths": [
    ".codex/agents/harness-reviewer.toml",
    ".agents/skills/review-output-contract/SKILL.md",
    ".agents/skills/harness-review-checklist/SKILL.md"
  ],
  "compatible_protocol_paths": [
    ".claude/agents/harness-reviewer.md",
    ".claude/skills/review-output-contract/SKILL.md",
    ".claude/skills/harness-review-checklist/SKILL.md"
  ],
  "reviewed_at": "2026-04-04T07:52:58Z",
  "findings": [],
  "residual_risks": [
    "`bash -n scripts/ci-local.sh`는 구문 검증만 하므로, 실제 local CI 실행 유효성은 후속에서 더 강하게 다룰 수 있다."
  ]
}
