{
  "task_id": "I-0018-015",
  "reviewer": "po-reviewer",
  "decision": "approved",
  "tool": "codex-manual-protocol-review",
  "review_contract": "repo-reviewer-artifact-v1",
  "executed_protocol_paths": [
    ".codex/agents/po-reviewer.toml",
    ".agents/skills/review-output-contract/SKILL.md",
    ".agents/skills/po-review-checklist/SKILL.md"
  ],
  "compatible_protocol_paths": [
    ".claude/agents/po-reviewer.md",
    ".claude/skills/review-output-contract/SKILL.md",
    ".claude/skills/po-review-checklist/SKILL.md"
  ],
  "reviewed_at": "2026-04-22T06:49:56Z",
  "findings": [],
  "residual_risks": [
    "Manual browser verification was not performed in this review.",
    "The product contract still depends on the dedicated source route in apps/api/src/workouts/workouts.controller.ts and the current web upload flow remaining aligned with it."
  ]
}
