{
  "task_id": "I-0018-050",
  "reviewer": "frontend-reviewer",
  "decision": "approved",
  "tool": "codex-manual-protocol-review",
  "review_contract": "repo-reviewer-artifact-v1",
  "executed_protocol_paths": [
    ".codex/agents/frontend-reviewer.toml",
    ".agents/skills/review-output-contract/SKILL.md",
    ".agents/skills/frontend-review-checklist/SKILL.md"
  ],
  "compatible_protocol_paths": [
    ".claude/agents/frontend-reviewer.md",
    ".claude/skills/review-output-contract/SKILL.md",
    ".claude/skills/frontend-review-checklist/SKILL.md"
  ],
  "reviewed_at": "2026-04-22T18:15:21Z",
  "findings": [],
  "residual_risks": [
    "The targeted workout detail page test now covers both missing-route-with-laps and full degraded cleanup with empty workoutRoutes/workoutLaps, but this approval assumes the reported web/API verify runs are accurate."
  ]
}
