{
  "task_id": "I-0016-090",
  "reviewer": "ui-ux-reviewer",
  "decision": "approved",
  "tool": "codex-manual-review",
  "review_contract": "repo-reviewer-artifact-v1",
  "executed_protocol_paths": [
    ".codex/agents/ui-ux-reviewer.toml",
    ".agents/skills/review-output-contract/SKILL.md",
    ".agents/skills/ui-ux-review-checklist/SKILL.md"
  ],
  "compatible_protocol_paths": [
    ".claude/agents/ui-ux-reviewer.md",
    ".claude/skills/review-output-contract/SKILL.md",
    ".claude/skills/ui-ux-review-checklist/SKILL.md"
  ],
  "reviewed_at": "2026-04-08T04:30:26Z",
  "findings": [],
  "residual_risks": [
    "Storybook workbench는 product polish를 위한 기반으로 충분하지만, button affordance와 surface hierarchy refinement는 후속 flow task에서 단계적으로 개선해야 한다."
  ]
}
