{
  "task_id": "I-0016-100",
  "reviewer": "ui-ux-reviewer",
  "decision": "approved",
  "tool": "codex-subagent",
  "review_contract": "repo-reviewer-artifact-v1",
  "executed_protocol_paths": [
    "reviewers/protocols.json",
    ".codex/agents/ui-ux-reviewer.toml",
    ".agents/skills/review-output-contract/SKILL.md",
    ".agents/skills/ui-ux-review-checklist/SKILL.md"
  ],
  "compatible_protocol_paths": [
    ".claude/agents/ui-ux-reviewer.md",
    ".claude/skills/review-output-contract/SKILL.md",
    ".claude/skills/ui-ux-review-checklist/SKILL.md"
  ],
  "reviewed_at": "2026-04-09T01:11:00Z",
  "findings": [],
  "residual_risks": [
    "The workout carousel now preserves card rhythm without showing the next card in-frame, but it is still worth sanity-checking once on a very narrow mobile viewport.",
    "The larger hashtag-inline content decision remains intentionally deferred, so content and tag rhythm should be revisited in a follow-up task instead of being folded into this pass."
  ]
}
