{
  "task_id": "I-0019-010",
  "reviewer": "backend-reviewer",
  "decision": "approved",
  "tool": "codex-manual-review",
  "review_contract": "repo-reviewer-artifact-v1",
  "executed_protocol_paths": [
    ".codex/agents/backend-reviewer.toml",
    ".agents/skills/review-output-contract/SKILL.md",
    ".agents/skills/backend-review-checklist/SKILL.md"
  ],
  "compatible_protocol_paths": [
    ".claude/agents/backend-reviewer.md",
    ".claude/skills/review-output-contract/SKILL.md",
    ".claude/skills/backend-review-checklist/SKILL.md"
  ],
  "reviewed_at": "2026-04-22T14:29:29Z",
  "findings": [],
  "residual_risks": [
    "The runtime/auth contract is consistent only while operators keep the required lane env values and Kakao secrets populated; missing lane vars now fail deploy early instead of degrading at runtime."
  ]
}
